query	no	title	link	description	total_text
경주여행	269	여자친구랑 1박2일로  경주여행 을 가려고 합니다.	https://kin.naver.com/qna/detail.naver?d1id=9&dirId=90111&docId=74876809&qb=6rK97KO87Jes7ZaJ&enc=utf8	이번주 토요일부터 일요일 까지 1박2일로 경주 여행 가려고 합니다 나이도 적잖이 있는데 여행이라고는 전혀 친하지 바다여행과 고적답사 천년고도 경주여행 으로 초대합니다 즐거운 여행되세요 역사와 문화가 많은 	여자친구랑 1박2일로  경주여행 을 가려고 합니다. 이번주 토요일부터 일요일 까지 1박2일로 경주 여행 가려고 합니다 나이도 적잖이 있는데 여행이라고는 전혀 친하지 바다여행과 고적답사 천년고도 경주여행 으로 초대합니다 즐거운 여행되세요 역사와 문화가 많은 
경주여행	270	 경주여행 이요~ 경주여행 으로 벚꽃축제 가려고 하는데요!	https://kin.naver.com/qna/detail.naver?d1id=9&dirId=901&docId=127781903&qb=6rK97KO87Jes7ZaJ&enc=utf8	 경주여행 질문 좀 하려구요 매년마다 그냥 여의도 벚꽃축제 경주여행 이라고 하면예 예전에 수학여행 때 많이 갔던 곳이라 지금 가면 또 기분도 다를 것 같고 경주여행 경주여행 가시는 군요 저도 경주여행 가고 싶네요 	 경주여행 이요~ 경주여행 으로 벚꽃축제 가려고 하는데요!  경주여행 질문 좀 하려구요 매년마다 그냥 여의도 벚꽃축제 경주여행 이라고 하면예 예전에 수학여행 때 많이 갔던 곳이라 지금 가면 또 기분도 다를 것 같고 경주여행 경주여행 가시는 군요 저도 경주여행 가고 싶네요 
경주여행	271	 경주여행  대중교통	https://kin.naver.com/qna/detail.naver?d1id=9&dirId=90111&docId=179363021&qb=6rK97KO87Jes7ZaJ&enc=utf8	부산출발로 금요일에 경주여행 을 할계획인데 우선 이동수단은 대중교통을 생각하고 있습니다 경주시 천군동에 그외에 버스들도 많으니 기사분에게 경주터미널가냐고 물어보시면 알려줄 겁니다 즐거운 경주여행 되세요 	 경주여행  대중교통 부산출발로 금요일에 경주여행 을 할계획인데 우선 이동수단은 대중교통을 생각하고 있습니다 경주시 천군동에 그외에 버스들도 많으니 기사분에게 경주터미널가냐고 물어보시면 알려줄 겁니다 즐거운 경주여행 되세요 
경주여행	272	 경주 여행 	https://kin.naver.com/qna/detail.naver?d1id=9&dirId=90111&docId=415681624&qb=6rK97KO87Jes7ZaJ&enc=utf8	 경주여행 갈려고 하는데요 경주에 귀신으로 유명한 심령스팟 같은데없 나요 알면 알려주세요 내공30검니다 어떤 목적으로 심령스팟을 찾으시는 건지는 모르지만 경주에 대릉원이 심령스팟이 아닐까요 거기 미추왕릉이 있어요 거기에 	 경주 여행   경주여행 갈려고 하는데요 경주에 귀신으로 유명한 심령스팟 같은데없 나요 알면 알려주세요 내공30검니다 어떤 목적으로 심령스팟을 찾으시는 건지는 모르지만 경주에 대릉원이 심령스팟이 아닐까요 거기 미추왕릉이 있어요 거기에 
경주여행	273	친구랑 당일로  경주 여행 을 하려는데요	https://kin.naver.com/qna/detail.naver?d1id=9&dirId=90111&docId=223867125&qb=6rK97KO87Jes7ZaJ&enc=utf8	 들꺼같아서 경주여행 경험이 있거나 현지인 분들한테 안비싸고 빠르게 갈수있는 방법이 있는지 어쭤보려 답변 당일 경주 여행 코스 추천 일단 희망하는 코스 동선을 분석해볼게요 경주시외버스터미널 출발 70 	친구랑 당일로  경주 여행 을 하려는데요  들꺼같아서 경주여행 경험이 있거나 현지인 분들한테 안비싸고 빠르게 갈수있는 방법이 있는지 어쭤보려 답변 당일 경주 여행 코스 추천 일단 희망하는 코스 동선을 분석해볼게요 경주시외버스터미널 출발 70 
경주여행	274	단체  경주여행 	https://kin.naver.com/qna/detail.naver?d1id=12&dirId=121102&docId=308232437&qb=6rK97KO87Jes7ZaJ&enc=utf8	10월 중순 15 20명 정도 경기도에서 경주여행 가려고합니다 경주까지 이동은 역사체험은 안좋아할것 같아서 경주 여행 을 환영합니다 신경주역에서 즐거운 경주 여행 되세요 추가 질문 있을 경우 연락 주세요 	단체  경주여행  10월 중순 15 20명 정도 경기도에서 경주여행 가려고합니다 경주까지 이동은 역사체험은 안좋아할것 같아서 경주 여행 을 환영합니다 신경주역에서 즐거운 경주 여행 되세요 추가 질문 있을 경우 연락 주세요 
경주여행	275	추석연휴 (토~월) 가족단위  경주 여행  갈만한 곳 문의	https://kin.naver.com/qna/detail.naver?d1id=9&dirId=90111&docId=474981875&qb=6rK97KO87Jes7ZaJ&enc=utf8	 나혼자산다 예고편을 보니 전현무 코쿤 이주승이 경주 여행 첨성대 등 을 한것이 나오던데 또 가고 저도 최근에 경주여행 을 다녀왔는데 글을 쓰다보니 경주를 또 가고 싶은 생각이 드네요 아래 사진 보시고 몇개 골라서 계획 	추석연휴 (토~월) 가족단위  경주 여행  갈만한 곳 문의  나혼자산다 예고편을 보니 전현무 코쿤 이주승이 경주 여행 첨성대 등 을 한것이 나오던데 또 가고 저도 최근에 경주여행 을 다녀왔는데 글을 쓰다보니 경주를 또 가고 싶은 생각이 드네요 아래 사진 보시고 몇개 골라서 계획 
경주여행	276	 경주여행  불교 유적 책	https://kin.naver.com/qna/detail.naver?d1id=11&dirId=111001&docId=391504609&qb=6rK97KO87Jes7ZaJ&enc=utf8	 경주여행 을 계획중입니다 제가 외국인이다 보니 한국의 역사를 잘 몰라서 가기 전에 책을 읽고 공부하고 싶습니다 그래서 신라시대의 역사 유적지 불교와 관련된 책을 추천부탁드립니다 유흥준의 나의문화유산답사기 중에서 신라쪽 	 경주여행  불교 유적 책  경주여행 을 계획중입니다 제가 외국인이다 보니 한국의 역사를 잘 몰라서 가기 전에 책을 읽고 공부하고 싶습니다 그래서 신라시대의 역사 유적지 불교와 관련된 책을 추천부탁드립니다 유흥준의 나의문화유산답사기 중에서 신라쪽 
경주여행	277	 경주여행 가는데 추천좀 해주세요	https://kin.naver.com/qna/detail.naver?d1id=12&dirId=121102&docId=388120381&qb=6rK97KO87Jes7ZaJ&enc=utf8	 경주여행 가는데 추천좀 해주세요 안녕하세요 경주 청도에 풀빌라 운영중이고 밑에 정보 남겨두겠습니다 각 지점별로 3월 초특가 할인 이벤트도 진행중이니 홈페이지 방문 후 문의주시고 좋은하루 되세요 1 경주 오푸스 	 경주여행 가는데 추천좀 해주세요  경주여행 가는데 추천좀 해주세요 안녕하세요 경주 청도에 풀빌라 운영중이고 밑에 정보 남겨두겠습니다 각 지점별로 3월 초특가 할인 이벤트도 진행중이니 홈페이지 방문 후 문의주시고 좋은하루 되세요 1 경주 오푸스 
경주여행	278	여자4명이서  경주여행 갑니다. 일정 좀 부탁드립니다.	https://kin.naver.com/qna/detail.naver?d1id=9&dirId=90111&docId=100536451&qb=6rK97KO87Jes7ZaJ&enc=utf8	26살 여자 4명이서 1박 2일로 경주여행 을 가거든요 연말파티 겸 해서 펜션에서 보내는데 보분단지 근처에 있구요 더 좋은 방법은 경주여행 후기를 몇개 읽어 보면 큰도움이 된답니다 좋은 여행 많이 하세요 	여자4명이서  경주여행 갑니다. 일정 좀 부탁드립니다. 26살 여자 4명이서 1박 2일로 경주여행 을 가거든요 연말파티 겸 해서 펜션에서 보내는데 보분단지 근처에 있구요 더 좋은 방법은 경주여행 후기를 몇개 읽어 보면 큰도움이 된답니다 좋은 여행 많이 하세요 
경주여행	279	 경주여행 을 하려고 합니다	https://kin.naver.com/qna/detail.naver?d1id=9&dirId=90111&docId=75183951&qb=6rK97KO87Jes7ZaJ&enc=utf8	안녕하세요 25살 회사원 입니다 저희반원들이 가족동반으로 경주여행 을 하려고 합니다 문제가 되는것이 숙바시설에 대해서 전혀 아는게 없습니다 숙박시설좀 가르처 주세요 총 인원은 16명입니다 어른 10명 아이 6명 가족동반이니까 	 경주여행 을 하려고 합니다 안녕하세요 25살 회사원 입니다 저희반원들이 가족동반으로 경주여행 을 하려고 합니다 문제가 되는것이 숙바시설에 대해서 전혀 아는게 없습니다 숙박시설좀 가르처 주세요 총 인원은 16명입니다 어른 10명 아이 6명 가족동반이니까 
경주여행	280	 경주 여행 을 갈건데요. 경주가볼만한곳과 꼭 알아야 할... 	https://kin.naver.com/qna/detail.naver?d1id=9&dirId=90111&docId=420124732&qb=6rK97KO87Jes7ZaJ&enc=utf8	제가 경주 여행 을 가는데요 거의 2주이상 있어야 해서요 도와주시면 내공걸게요 숙소는 코오롱호텔입니다 안녕하세요 경주여행 2주동안 같아요 경주여행 음식 숙박 문화행사 문화재 역사 여행필수정보 	 경주 여행 을 갈건데요. 경주가볼만한곳과 꼭 알아야 할...  제가 경주 여행 을 가는데요 거의 2주이상 있어야 해서요 도와주시면 내공걸게요 숙소는 코오롱호텔입니다 안녕하세요 경주여행 2주동안 같아요 경주여행 음식 숙박 문화행사 문화재 역사 여행필수정보 
경주여행	281	 경주여행 ~	https://kin.naver.com/qna/detail.naver?d1id=13&dirId=1306&docId=111819180&qb=6rK97KO87Jes7ZaJ&enc=utf8	 경주여행 을 하려고 하는데요 일정을 알려드리겟습니다 울산 경주 경주시내 숙박 경주월드 울산 이렇게 저도 경주 여행 갔을 때 여기서 숙박했었는데 아주 만족이었어요 한옥 민박인데 깨끗하고 저렴하고 특히 주인 아저씨 	 경주여행 ~  경주여행 을 하려고 하는데요 일정을 알려드리겟습니다 울산 경주 경주시내 숙박 경주월드 울산 이렇게 저도 경주 여행 갔을 때 여기서 숙박했었는데 아주 만족이었어요 한옥 민박인데 깨끗하고 저렴하고 특히 주인 아저씨 
경주여행	282	10월  경주여행  코스	https://kin.naver.com/qna/detail.naver?d1id=9&dirId=90111&docId=456737894&qb=6rK97KO87Jes7ZaJ&enc=utf8	 질문하신 경주여행 코스 관련 답변 드리도록 하겠습니다 10월에 가볼만한 곳으로 경주 여행 코스를 알아보고 계시나 봅니다 경주는 한복을 입고 방문하기에 매우 적합한 곳이며 역사적이고 아름다운 장소가 많이 있습니다 	10월  경주여행  코스  질문하신 경주여행 코스 관련 답변 드리도록 하겠습니다 10월에 가볼만한 곳으로 경주 여행 코스를 알아보고 계시나 봅니다 경주는 한복을 입고 방문하기에 매우 적합한 곳이며 역사적이고 아름다운 장소가 많이 있습니다 
경주여행	283	 경주여행  관련 질문이요!! 숙소랑 가볼만한곳 추천좀... 	https://kin.naver.com/qna/detail.naver?d1id=9&dirId=90111&docId=373258567&qb=6rK97KO87Jes7ZaJ&enc=utf8	여자친구랑 경주여행 계획중인데 좋은 펜션이나 풀빌라 그리고 데이트 할만한곳 추천좀 부탁드립니다 경주 여행 준비중이시라면 추천드리고 싶은 펜션이 하나 있습니다 경주의아침펜션인데요 아래 사진 보시면 아시겠지만 	 경주여행  관련 질문이요!! 숙소랑 가볼만한곳 추천좀...  여자친구랑 경주여행 계획중인데 좋은 펜션이나 풀빌라 그리고 데이트 할만한곳 추천좀 부탁드립니다 경주 여행 준비중이시라면 추천드리고 싶은 펜션이 하나 있습니다 경주의아침펜션인데요 아래 사진 보시면 아시겠지만 
경주여행	284	 경주 여행  박물관 많이 알려주세요	https://kin.naver.com/qna/detail.naver?d1id=9&dirId=90111&docId=469733442&qb=6rK97KO87Jes7ZaJ&enc=utf8	 동궁 첨성대 월정교의 야경도 멋진 경주 여행 추천해 드려봅니다 먼저 여행 날짜가 언제인지 모르겠지만 경주의 왕복 약 3 5시간 3일차 시내권 불국사권 4일차 황리단길의 카페 및 맛집 행복하고 즐거운 경주 여행 되세요 	 경주 여행  박물관 많이 알려주세요  동궁 첨성대 월정교의 야경도 멋진 경주 여행 추천해 드려봅니다 먼저 여행 날짜가 언제인지 모르겠지만 경주의 왕복 약 3 5시간 3일차 시내권 불국사권 4일차 황리단길의 카페 및 맛집 행복하고 즐거운 경주 여행 되세요 
경주여행	285	 경주여행  코스	https://kin.naver.com/qna/detail.naver?d1id=12&dirId=121102&docId=287379584&qb=6rK97KO87Jes7ZaJ&enc=utf8	혼자 경주여행 을 가는데요 코스짜는게 너무 어렵네여 경주시외버스터미널에서 내리고 숙소는 도와주세요 경주 여행 환영합니다 경주 도착을 가능한 빨리 하시고 아래 일정으로 추천 드립니다 도착일 황리단길 점심 	 경주여행  코스 혼자 경주여행 을 가는데요 코스짜는게 너무 어렵네여 경주시외버스터미널에서 내리고 숙소는 도와주세요 경주 여행 환영합니다 경주 도착을 가능한 빨리 하시고 아래 일정으로 추천 드립니다 도착일 황리단길 점심 
경주여행	286	1박2일  경주여행  코스(꼼꼼하게) 내공있음	https://kin.naver.com/qna/detail.naver?d1id=9&dirId=90111&docId=153432107&qb=6rK97KO87Jes7ZaJ&enc=utf8	안녕하세요 7월 중순 1박 2일로 주말 경주 여행 을 가려고 합니다 토요일에 출근을 해야 해서 경주에 도착하면 경주여행 은 권역별로 분류 되어 있어서 참으로 구경하기가 좋은 곳입니다 먼저 경주에 오시면 숙소에서 여정을 푸시고 	1박2일  경주여행  코스(꼼꼼하게) 내공있음 안녕하세요 7월 중순 1박 2일로 주말 경주 여행 을 가려고 합니다 토요일에 출근을 해야 해서 경주에 도착하면 경주여행 은 권역별로 분류 되어 있어서 참으로 구경하기가 좋은 곳입니다 먼저 경주에 오시면 숙소에서 여정을 푸시고 
경주여행	287	 경주여행  1박 2일 용돈은 얼마정도 챙기는게 좋을까요??	https://kin.naver.com/qna/detail.naver?d1id=9&dirId=90111&docId=449991226&qb=6rK97KO87Jes7ZaJ&enc=utf8	 경주여행 1박 2일 용돈은 얼마정도 챙기는게 좋을까요 경주여행 1박 2일 동안의 용돈은 다양한 요인에 따라 따라서 경주여행 1박 2일 동안의 용돈 총액은 대략적으로 다음과 같이 계산될 수 있습니다 기념품 10 000원 30 000원 	 경주여행  1박 2일 용돈은 얼마정도 챙기는게 좋을까요??  경주여행 1박 2일 용돈은 얼마정도 챙기는게 좋을까요 경주여행 1박 2일 동안의 용돈은 다양한 요인에 따라 따라서 경주여행 1박 2일 동안의 용돈 총액은 대략적으로 다음과 같이 계산될 수 있습니다 기념품 10 000원 30 000원 
경주여행	288	 경주여행  코스	https://kin.naver.com/qna/detail.naver?d1id=13&dirId=1306&docId=138267885&qb=6rK97KO87Jes7ZaJ&enc=utf8	저희 가족이 경주여행 을 가는데 9시 쯤에 경주에 도착해서 다음날 8시에 집으로 가는데 경주여행 코스를 아직 정하지 못했습니다 경주여행 코스좀 정해주세요 저희는 신경주역에서 내립니다 질문자님 방갑습니당 경주여행 코스에 	 경주여행  코스 저희 가족이 경주여행 을 가는데 9시 쯤에 경주에 도착해서 다음날 8시에 집으로 가는데 경주여행 코스를 아직 정하지 못했습니다 경주여행 코스좀 정해주세요 저희는 신경주역에서 내립니다 질문자님 방갑습니당 경주여행 코스에 
경주여행	289	 경주 여행 할려고 합니다~	https://kin.naver.com/qna/detail.naver?d1id=9&dirId=90111&docId=277913032&qb=6rK97KO87Jes7ZaJ&enc=utf8	 경주여행 은 처음입니다 경주 시외버스터미널 혹은 고속터미널에서 황리단길까지 걸어서 갈수 있는 거리인가요 지도를 보았을 때 갈 수 있을 것 같은데 잘 모르겠네요 그리고 첨성대 안압지도 걸어서 갈 수 있는 거리인가요 	 경주 여행 할려고 합니다~  경주여행 은 처음입니다 경주 시외버스터미널 혹은 고속터미널에서 황리단길까지 걸어서 갈수 있는 거리인가요 지도를 보았을 때 갈 수 있을 것 같은데 잘 모르겠네요 그리고 첨성대 안압지도 걸어서 갈 수 있는 거리인가요 
경주여행	290	1박2일  경주여행  추천코스 부탁드립니다.	https://kin.naver.com/qna/detail.naver?d1id=9&dirId=90111&docId=151342052&qb=6rK97KO87Jes7ZaJ&enc=utf8	1박 2일로 경주여행 을 가려고 합니다 보문관광단지와 안압지 첨성대 등 1박 2일로 경주여행 을 가려고 합니다 보문관광단지와 안압지 첨성대 등 보았듯이 경주여행 중에 스탬프투어가 있는데 이투어 추천해드립니다 자전거로 	1박2일  경주여행  추천코스 부탁드립니다. 1박 2일로 경주여행 을 가려고 합니다 보문관광단지와 안압지 첨성대 등 1박 2일로 경주여행 을 가려고 합니다 보문관광단지와 안압지 첨성대 등 보았듯이 경주여행 중에 스탬프투어가 있는데 이투어 추천해드립니다 자전거로 
경주여행	291	 경주 여행 질문	https://kin.naver.com/qna/detail.naver?d1id=9&dirId=90111&docId=395772573&qb=6rK97KO87Jes7ZaJ&enc=utf8	요번주 저 혼자 경주 여행 당일치기로 갓다올껀데 여자 혼자 가기좋은 경주 코스쫌 알려주세요 그리고 돈 많이 안드는 곳으로 추천해주세요 낮에만 갓다가 저녁에 올거라서요 안녕하세요 토글 하루보험 입니다 경주는 볼거리가 너무 	 경주 여행 질문 요번주 저 혼자 경주 여행 당일치기로 갓다올껀데 여자 혼자 가기좋은 경주 코스쫌 알려주세요 그리고 돈 많이 안드는 곳으로 추천해주세요 낮에만 갓다가 저녁에 올거라서요 안녕하세요 토글 하루보험 입니다 경주는 볼거리가 너무 
경주여행	292	 경주 여행 코스 문의드려요!!	https://kin.naver.com/qna/detail.naver?d1id=9&dirId=90111&docId=274606498&qb=6rK97KO87Jes7ZaJ&enc=utf8	가족들이랑 경주여행 을 가려고 하는데 경주 여행 코스를 어떻게 해야할지 모르겟네요 사실 중학교때 가보고 안가봤어요 경주 여행 코스 가장 핫플레이스만 가보고 싶어요 혹시 경주 여행 코스 다들 어떻게 	 경주 여행 코스 문의드려요!! 가족들이랑 경주여행 을 가려고 하는데 경주 여행 코스를 어떻게 해야할지 모르겟네요 사실 중학교때 가보고 안가봤어요 경주 여행 코스 가장 핫플레이스만 가보고 싶어요 혹시 경주 여행 코스 다들 어떻게 
경주여행	293	 경주여행  몇박	https://kin.naver.com/qna/detail.naver?d1id=9&dirId=901&docId=442657560&qb=6rK97KO87Jes7ZaJ&enc=utf8	4월에 경주여행 을 가려합니다 가서 렌트카를 빌려서 다닐예정인데 경주는 1박2일이면 충분할까요 아님 2박3일 가야할까요 1박2일이면 충분합니다	 경주여행  몇박 4월에 경주여행 을 가려합니다 가서 렌트카를 빌려서 다닐예정인데 경주는 1박2일이면 충분할까요 아님 2박3일 가야할까요 1박2일이면 충분합니다
경주여행	294	 경주여행 코스!	https://kin.naver.com/qna/detail.naver?d1id=9&dirId=90111&docId=292139666&qb=6rK97KO87Jes7ZaJ&enc=utf8	동생과 당일치기 혹은 1박으로 경주여행 을 가려고해요 가고싶은곳은 황리단길 주렁주렁 콜로세움 추억의달동네 경주 여행 을 환영합니다 Case1 당일 여행 추억에달동네 콜로세움 주렁주렁 황리단길 안압지 첨성대 야경 Case2 1박2일 	 경주여행 코스! 동생과 당일치기 혹은 1박으로 경주여행 을 가려고해요 가고싶은곳은 황리단길 주렁주렁 콜로세움 추억의달동네 경주 여행 을 환영합니다 Case1 당일 여행 추억에달동네 콜로세움 주렁주렁 황리단길 안압지 첨성대 야경 Case2 1박2일 
경주여행	295	 경주여행 추천	https://kin.naver.com/qna/detail.naver?d1id=9&dirId=90111&docId=450477144&qb=6rK97KO87Jes7ZaJ&enc=utf8	 괜찮아용 경주 여행 을 계획중이시군요 그럼 경주에서 꼭 가봐야한는 곳들 추천해드리겠습니다 첨성대 황리단길 대릉원 월정교 동궁과 월지 동궁원 화랑의 언덕 	 경주여행 추천  괜찮아용 경주 여행 을 계획중이시군요 그럼 경주에서 꼭 가봐야한는 곳들 추천해드리겠습니다 첨성대 황리단길 대릉원 월정교 동궁과 월지 동궁원 화랑의 언덕 
경주여행	296	 경주 여행 에 관해서 자문을 얻고자 이렇게 질문을 하네요..	https://kin.naver.com/qna/detail.naver?d1id=9&dirId=90111&docId=130782811&qb=6rK97KO87Jes7ZaJ&enc=utf8	 제가 6월4일부터 6일까지 2박3일로 경주 여행 을 친구들과 갈려고 하는데요 경주여행 은 처음이라 일정을 어떻게 정말 알짜배기 정보만 모아 놓아서 초보여행자에겐 도움이 많이 되죠 경주 톨게이트 지나면 바로 오른 편에 경주여행 안 	 경주 여행 에 관해서 자문을 얻고자 이렇게 질문을 하네요..  제가 6월4일부터 6일까지 2박3일로 경주 여행 을 친구들과 갈려고 하는데요 경주여행 은 처음이라 일정을 어떻게 정말 알짜배기 정보만 모아 놓아서 초보여행자에겐 도움이 많이 되죠 경주 톨게이트 지나면 바로 오른 편에 경주여행 안 
경주여행	297	1박2일코스 자전거로  경주여행 하고싶어요~	https://kin.naver.com/qna/detail.naver?d1id=9&dirId=90111&docId=147556443&qb=6rK97KO87Jes7ZaJ&enc=utf8	 둘러보면서 경주여행 해보고싶어서요 그리구 때맞침 이때 벚꽃도 경주여행 을 계획하고 있으시군요 1박2일 여행일정이니 다소 빡빡하게 제 블로그로 오셔서 문의주세요 즐거운 경주여행 하시길 바래요 http blog naver com ponat3	1박2일코스 자전거로  경주여행 하고싶어요~  둘러보면서 경주여행 해보고싶어서요 그리구 때맞침 이때 벚꽃도 경주여행 을 계획하고 있으시군요 1박2일 여행일정이니 다소 빡빡하게 제 블로그로 오셔서 문의주세요 즐거운 경주여행 하시길 바래요 http blog naver com ponat3
경주여행	298	 경주 여행  계획표 봐주세용	https://kin.naver.com/qna/detail.naver?d1id=9&dirId=90111&docId=393543073&qb=6rK97KO87Jes7ZaJ&enc=utf8	안녕하세요 이번에 여자친구와 경주여행 을 가게되어서 계획표를 한번 짜봤거든용 계획표 일정 괜찮나요 혹시 시간을 너무 많이 쓰는 관광지가 있다거나 이거 꼭 봐야되는데 빼먹은게 있다거나 동선이 이상하다던지 지적 및 수정 할거 	 경주 여행  계획표 봐주세용 안녕하세요 이번에 여자친구와 경주여행 을 가게되어서 계획표를 한번 짜봤거든용 계획표 일정 괜찮나요 혹시 시간을 너무 많이 쓰는 관광지가 있다거나 이거 꼭 봐야되는데 빼먹은게 있다거나 동선이 이상하다던지 지적 및 수정 할거 
경주여행	299	아이들과 즐거운  경주여행  코스 부탁드립니다.(2박3일)	https://kin.naver.com/qna/detail.naver?d1id=9&dirId=90111&docId=163048459&qb=6rK97KO87Jes7ZaJ&enc=utf8	 경주여행 이 처음이라 고수 여러분의 도움을 청합니다 경주여행 에 필요한 경주지도 경주시청 홈페이지 가시면 경주여행 에 필요한 관광지소개 지도를 무료로 받을 수 아이 위주로 경주여행 지를 추천하자면 체험과 관람 위주의 	아이들과 즐거운  경주여행  코스 부탁드립니다.(2박3일)  경주여행 이 처음이라 고수 여러분의 도움을 청합니다 경주여행 에 필요한 경주지도 경주시청 홈페이지 가시면 경주여행 에 필요한 관광지소개 지도를 무료로 받을 수 아이 위주로 경주여행 지를 추천하자면 체험과 관람 위주의 
경주여행	300	 경주여행 코스 질문 경주에서 유명한 곳과 숙박시설... 	https://kin.naver.com/qna/detail.naver?d1id=9&dirId=90111&docId=374401351&qb=6rK97KO87Jes7ZaJ&enc=utf8	 경주여행 알차게 다녀오고 싶은데 가볼만한곳이랑 숙박시설 좋은 곳 추천좀 해주세요 경주불국사 안압지 너무이쁜 오푸스11풀빌라 도 추천이요 경주여행 코스 오푸스11풀빌라 영상 감상하세요 경주여행 코스 오푸스11풀빌라	 경주여행 코스 질문 경주에서 유명한 곳과 숙박시설...   경주여행 알차게 다녀오고 싶은데 가볼만한곳이랑 숙박시설 좋은 곳 추천좀 해주세요 경주불국사 안압지 너무이쁜 오푸스11풀빌라 도 추천이요 경주여행 코스 오푸스11풀빌라 영상 감상하세요 경주여행 코스 오푸스11풀빌라
