query	no	title	link	description	total_text
경주여행	133	 경주 여행  동선좀 알려주세요~	https://kin.naver.com/qna/detail.naver?d1id=12&dirId=12110212&docId=222556649&qb=6rK97KO87Jes7ZaJ&enc=utf8	안녕하세요 지식인님들 여자친구와 경주여행 을 가려고 하는데요 이동수단은 자차를 이용할거구요 대구에서 덕분에 경주여행 을 자주 하게 됩니다 제 경험을 조금 공유할까 합니다 우선 동선을 파악해봐야겠군요 대구 	 경주 여행  동선좀 알려주세요~ 안녕하세요 지식인님들 여자친구와 경주여행 을 가려고 하는데요 이동수단은 자차를 이용할거구요 대구에서 덕분에 경주여행 을 자주 하게 됩니다 제 경험을 조금 공유할까 합니다 우선 동선을 파악해봐야겠군요 대구 
경주여행	134	 경주여행  2박3일	https://kin.naver.com/qna/detail.naver?d1id=20&dirId=2002&docId=463417631&qb=6rK97KO87Jes7ZaJ&enc=utf8	 경주여행 처음인데 여쭤볼게있습니다 1 부산에서경주 아니면 대구에서 경주가 나을까요 2 경주숙소위치는 어디가 괜찮을까요 동네이름 적어주시면 감사하겠습니다 안녕하세요 경주 라구스힐 풀빌라 펜션입니다 환절기인 만큼 	 경주여행  2박3일  경주여행 처음인데 여쭤볼게있습니다 1 부산에서경주 아니면 대구에서 경주가 나을까요 2 경주숙소위치는 어디가 괜찮을까요 동네이름 적어주시면 감사하겠습니다 안녕하세요 경주 라구스힐 풀빌라 펜션입니다 환절기인 만큼 
경주여행	135	 경주 여행  코스	https://kin.naver.com/qna/detail.naver?d1id=12&dirId=121102&docId=226939317&qb=6rK97KO87Jes7ZaJ&enc=utf8	아이들을 데리고 경주여행 을 갈려고 합니다 당일치기 당일치기 경주여행 코스 추천합니다 안녕하세요 2코스 경주 남산 정복하기 경주 여행 코스 중에서 많은 4코스 불국사와 석굴암 관람하기 경주여행 의 랜드마크죠 	 경주 여행  코스 아이들을 데리고 경주여행 을 갈려고 합니다 당일치기 당일치기 경주여행 코스 추천합니다 안녕하세요 2코스 경주 남산 정복하기 경주 여행 코스 중에서 많은 4코스 불국사와 석굴암 관람하기 경주여행 의 랜드마크죠 
경주여행	136	 경주여행 코스?	https://kin.naver.com/qna/detail.naver?d1id=9&dirId=90111&docId=475863908&qb=6rK97KO87Jes7ZaJ&enc=utf8	 좋을까요 경주 여행 에서 주요 관광지들의 동선과 주차를 고려해 코스를 짜는 방법을 아래와 같이 추천드립니다 1 불국사 석굴암 코스 추천 먼저 불국사에 도착하여 주차한 뒤 불국사를 둘러보세요 불국사에서 석굴암까지는 	 경주여행 코스?  좋을까요 경주 여행 에서 주요 관광지들의 동선과 주차를 고려해 코스를 짜는 방법을 아래와 같이 추천드립니다 1 불국사 석굴암 코스 추천 먼저 불국사에 도착하여 주차한 뒤 불국사를 둘러보세요 불국사에서 석굴암까지는 
경주여행	137	 경주 여행  질문드립니다	https://kin.naver.com/qna/detail.naver?d1id=9&dirId=90111&docId=483281928&qb=6rK97KO87Jes7ZaJ&enc=utf8	 가기가 좀 그렇네요 경주 여행 가이드 교통편 맛집 볼거리까지 모두 알려줄게요 경주는 한국의 역사와 문화가 살아 숨 쉬는 도시로 여행하기 좋은 명소가 많아요 2025년 봄 경주로 떠나고 싶은 분들을 위해 	 경주 여행  질문드립니다  가기가 좀 그렇네요 경주 여행 가이드 교통편 맛집 볼거리까지 모두 알려줄게요 경주는 한국의 역사와 문화가 살아 숨 쉬는 도시로 여행하기 좋은 명소가 많아요 2025년 봄 경주로 떠나고 싶은 분들을 위해 
경주여행	138	 경주여행  1박2일..어케 해야하죠?	https://kin.naver.com/qna/detail.naver?d1id=9&dirId=901&docId=138713802&qb=6rK97KO87Jes7ZaJ&enc=utf8	 경주여행 을 1박 2일정도 혼자 갈려고 합니다 경기도 경주여행 일정과 형편에 맞게 아래코스에서 조절하면 054 743 6001 아래사이트에서 경주여행 후기 몇편만 읽어보면 많은 도움이 될것입니다 좋은 경주여행 다녀 	 경주여행  1박2일..어케 해야하죠?  경주여행 을 1박 2일정도 혼자 갈려고 합니다 경기도 경주여행 일정과 형편에 맞게 아래코스에서 조절하면 054 743 6001 아래사이트에서 경주여행 후기 몇편만 읽어보면 많은 도움이 될것입니다 좋은 경주여행 다녀 
경주여행	139	이번 추석때  경주 여행 가려는데 코스 추천좀 부탁드립니다	https://kin.naver.com/qna/detail.naver?d1id=9&dirId=90111&docId=399334854&qb=6rK97KO87Jes7ZaJ&enc=utf8	 28살 청년입니다 다가오는 추석 연휴에 충주에서 경주로 여자친구랑 둘이 여행가보려하는데 경주 여행 은 자차 있어서 자차끌고 가려해요 많은 관심과 추천 부탁드립니다 안녕하세요 경주 여행 코스 추천드려요 	이번 추석때  경주 여행 가려는데 코스 추천좀 부탁드립니다  28살 청년입니다 다가오는 추석 연휴에 충주에서 경주로 여자친구랑 둘이 여행가보려하는데 경주 여행 은 자차 있어서 자차끌고 가려해요 많은 관심과 추천 부탁드립니다 안녕하세요 경주 여행 코스 추천드려요 
경주여행	140	전주, 경주 여행 코스	https://kin.naver.com/qna/detail.naver?d1id=9&dirId=901&docId=474983238&qb=6rK97KO87Jes7ZaJ&enc=utf8	 나혼자산다 예고편을 보니 전현무 코쿤 이주승이 경주 여행 첨성대 등 을 한것이 나오던데 또 가고 저도 최근에 경주여행 을 다녀왔는데 글을 쓰다보니 경주를 또 가고 싶은 생각이 드네요 아래 사진 보시고 몇개 골라서 계획 	전주, 경주 여행 코스  나혼자산다 예고편을 보니 전현무 코쿤 이주승이 경주 여행 첨성대 등 을 한것이 나오던데 또 가고 저도 최근에 경주여행 을 다녀왔는데 글을 쓰다보니 경주를 또 가고 싶은 생각이 드네요 아래 사진 보시고 몇개 골라서 계획 
경주여행	141	[내공100]  경주여행  꼭 가야하는 곳!!!!!	https://kin.naver.com/qna/detail.naver?d1id=12&dirId=12110212&docId=203240749&qb=6rK97KO87Jes7ZaJ&enc=utf8	안녕하세요 2박3일 경주여행 계획하고 있는 사람입니다 가족여행이구요 이 외에 경주여행 꼭 가야하는 곳이나 여행지 추천해주세요 예 무열왕릉 등 이 외에 경주여행 꼭 가야하는 곳이나 여행지 추천해주세요 예 무열왕릉 등 	[내공100]  경주여행  꼭 가야하는 곳!!!!! 안녕하세요 2박3일 경주여행 계획하고 있는 사람입니다 가족여행이구요 이 외에 경주여행 꼭 가야하는 곳이나 여행지 추천해주세요 예 무열왕릉 등 이 외에 경주여행 꼭 가야하는 곳이나 여행지 추천해주세요 예 무열왕릉 등 
경주여행	142	 경주여행 코스 추천해주세요!!	https://kin.naver.com/qna/detail.naver?d1id=9&dirId=9&docId=254943812&qb=6rK97KO87Jes7ZaJ&enc=utf8	경주로 여행 가려고 하는데 경주여행 코스 추천좀 해주세요 맛집이나 숙박도 알려주시면 좋구요 경주풀빌라추천 경주스파펜션 경주애견동반 경주데이트 경주커플펜션 경주가족펜션 경주여행 사진 설명을 입력하세요 	 경주여행 코스 추천해주세요!! 경주로 여행 가려고 하는데 경주여행 코스 추천좀 해주세요 맛집이나 숙박도 알려주시면 좋구요 경주풀빌라추천 경주스파펜션 경주애견동반 경주데이트 경주커플펜션 경주가족펜션 경주여행 사진 설명을 입력하세요 
경주여행	143	혼자가는 1박 2일  경주 여행 코스	https://kin.naver.com/qna/detail.naver?d1id=9&dirId=90111&docId=135099890&qb=6rK97KO87Jes7ZaJ&enc=utf8	제가 휴가로 혼자 1박 2일 경주 여행 을 가려고 합니다 저의 첫 번째 여행에 도움 부탁드려요 경주여행 일정과 054 743 6001 아래사이트에서 경주여행 후기 몇편만 읽어보면 많은 도움이 될것입니다 좋은 경주여행 다녀 	혼자가는 1박 2일  경주 여행 코스 제가 휴가로 혼자 1박 2일 경주 여행 을 가려고 합니다 저의 첫 번째 여행에 도움 부탁드려요 경주여행 일정과 054 743 6001 아래사이트에서 경주여행 후기 몇편만 읽어보면 많은 도움이 될것입니다 좋은 경주여행 다녀 
경주여행	144	1박2일  경주여행 	https://kin.naver.com/qna/detail.naver?d1id=9&dirId=90111&docId=151289529&qb=6rK97KO87Jes7ZaJ&enc=utf8	6월초에 언니랑 둘이서 1박2일로 경주여행 다녀올까 봐둔곳이있습니다 경주여행 일정과 형편에 맞게 054 743 6001 아래사이트에서 경주여행 후기 몇편만 읽어보면 많은 도움이 될것입니다 좋은 경주여행 다녀 	1박2일  경주여행  6월초에 언니랑 둘이서 1박2일로 경주여행 다녀올까 봐둔곳이있습니다 경주여행 일정과 형편에 맞게 054 743 6001 아래사이트에서 경주여행 후기 몇편만 읽어보면 많은 도움이 될것입니다 좋은 경주여행 다녀 
경주여행	145	 경주여행  스케줄	https://kin.naver.com/qna/detail.naver?d1id=9&dirId=90105&docId=430944679&qb=6rK97KO87Jes7ZaJ&enc=utf8	 경주여행 2박 3일 여행가는데 스케쥴좀 짜주세요 워터파크 경주월드 이런데 말고 역사 관련 문화유산 위주로요 그리고 참고로 가족여행이에요 다들 저질체력이라 하루에2 3개 	 경주여행  스케줄  경주여행 2박 3일 여행가는데 스케쥴좀 짜주세요 워터파크 경주월드 이런데 말고 역사 관련 문화유산 위주로요 그리고 참고로 가족여행이에요 다들 저질체력이라 하루에2 3개 
경주여행	146	 경주여행  장소	https://kin.naver.com/qna/detail.naver?d1id=9&dirId=90111&docId=430145793&qb=6rK97KO87Jes7ZaJ&enc=utf8	1박2일 경주여행 첫째날은 황리단길 갈 예정이고 둘째날은 보문단지랑 불국사랑 어디를 가는게 더 나을까요 놀거리 위주라면 보문단지쪽으로 가시고 걷고 볼거리를 생각하신다면 불국사쪽으로 	 경주여행  장소 1박2일 경주여행 첫째날은 황리단길 갈 예정이고 둘째날은 보문단지랑 불국사랑 어디를 가는게 더 나을까요 놀거리 위주라면 보문단지쪽으로 가시고 걷고 볼거리를 생각하신다면 불국사쪽으로 
경주여행	147	 경주 여행 	https://kin.naver.com/qna/detail.naver?d1id=9&dirId=90111&docId=444214600&qb=6rK97KO87Jes7ZaJ&enc=utf8	 경주여행 하려고 하는데 4월 29 30 일박 이일 동안 머물수있는 숙소 추천 부탁드립니다 가격대는 이십만원 아래로 하고 잠이 많아서 되도록이면 11식 체크아웃이 아닌곳 그리고 볼거리가 많은 경주 시내로 추천해주셨으면 	 경주 여행   경주여행 하려고 하는데 4월 29 30 일박 이일 동안 머물수있는 숙소 추천 부탁드립니다 가격대는 이십만원 아래로 하고 잠이 많아서 되도록이면 11식 체크아웃이 아닌곳 그리고 볼거리가 많은 경주 시내로 추천해주셨으면 
경주여행	148	 경주여행  1박2일 코스좀 부탁드립니다.	https://kin.naver.com/qna/detail.naver?d1id=9&dirId=901&docId=137625538&qb=6rK97KO87Jes7ZaJ&enc=utf8	1박2일로 혼자여행 하려고 하는데 경주여행 은 처음이라 경주여행 일정과 형편에 맞게 아래코스에서 조절하면 054 743 6001 아래사이트에서 경주여행 후기 몇편만 읽어보면 많은 도움이 될것입니다 좋은 경주여행 다녀 	 경주여행  1박2일 코스좀 부탁드립니다. 1박2일로 혼자여행 하려고 하는데 경주여행 은 처음이라 경주여행 일정과 형편에 맞게 아래코스에서 조절하면 054 743 6001 아래사이트에서 경주여행 후기 몇편만 읽어보면 많은 도움이 될것입니다 좋은 경주여행 다녀 
경주여행	149	 경주 여행 코스!!	https://kin.naver.com/qna/detail.naver?d1id=9&dirId=90105&docId=347541068&qb=6rK97KO87Jes7ZaJ&enc=utf8	 경주 여행 을 가려고 하는데요 가보고 싶은곳은 다 정했는데 코스를 어찌해야 좋을지 잘 모르겠어서요 총 3일로 주상절리 경주여행 코스 보문단지 황리단길 경주에서 가볼만한 곳 들에 가깝게 위치하고 있습니다 많이 	 경주 여행 코스!!  경주 여행 을 가려고 하는데요 가보고 싶은곳은 다 정했는데 코스를 어찌해야 좋을지 잘 모르겠어서요 총 3일로 주상절리 경주여행 코스 보문단지 황리단길 경주에서 가볼만한 곳 들에 가깝게 위치하고 있습니다 많이 
경주여행	150	 경주여행  일정	https://kin.naver.com/qna/detail.naver?d1id=9&dirId=90111&docId=133794393&qb=6rK97KO87Jes7ZaJ&enc=utf8	안녕하세요 이번에 경주여행 을 가려는데 혼자서는 맛집도 있으면 알려주세요 경주여행 일정과 형편에 맞게 054 743 6001 아래사이트에서 경주여행 후기 몇편만 읽어보면 많은 도움이 될것입니다 좋은 경주여행 다녀 	 경주여행  일정 안녕하세요 이번에 경주여행 을 가려는데 혼자서는 맛집도 있으면 알려주세요 경주여행 일정과 형편에 맞게 054 743 6001 아래사이트에서 경주여행 후기 몇편만 읽어보면 많은 도움이 될것입니다 좋은 경주여행 다녀 
경주여행	151	 경주여행  차를 가지고 가야 할까요?	https://kin.naver.com/qna/detail.naver?d1id=12&dirId=121102&docId=219068619&qb=6rK97KO87Jes7ZaJ&enc=utf8	 경주여행 을 하기로 했는데 경주까지 너무 멀어서 걱정이네요 차를 놓고 구경할 곳도 많을거구요 경주 여행 하실 때 필요한 정보들 모아 놓은 경주여행 에 도움이 되셨으면 좋겠네요 경주야 홈페이지 www 경주야 com 	 경주여행  차를 가지고 가야 할까요?  경주여행 을 하기로 했는데 경주까지 너무 멀어서 걱정이네요 차를 놓고 구경할 곳도 많을거구요 경주 여행 하실 때 필요한 정보들 모아 놓은 경주여행 에 도움이 되셨으면 좋겠네요 경주야 홈페이지 www 경주야 com 
경주여행	152	 경주여행 코스추천요	https://kin.naver.com/qna/detail.naver?d1id=9&dirId=90111&docId=347417465&qb=6rK97KO87Jes7ZaJ&enc=utf8	3월20금요일밤에경기도에서 출발해서 22일오전까지 경주여행 하려해요 코스추천해주세요 안녕하세요 경주 주상절리 경주여행 코스 보문단지 황리단길 경주에서 가볼만한 곳 들에 가깝게 위치하고 있습니다 많이 찾아주세요 	 경주여행 코스추천요 3월20금요일밤에경기도에서 출발해서 22일오전까지 경주여행 하려해요 코스추천해주세요 안녕하세요 경주 주상절리 경주여행 코스 보문단지 황리단길 경주에서 가볼만한 곳 들에 가깝게 위치하고 있습니다 많이 찾아주세요 
경주여행	153	 경주 여행 	https://kin.naver.com/qna/detail.naver?d1id=9&dirId=90111&docId=74175460&qb=6rK97KO87Jes7ZaJ&enc=utf8	 둘이서 경주 여행 거의 유명한 유적을 보기위한 을 가보려고합니다 초등학생에겐 경주여행 만큼 도움되는 등 150 000원대 전후로 투숙 가능 경주여행 시티투어 홈페이지 천마관광 www cmtour net 문 의 054 743 6001 	 경주 여행   둘이서 경주 여행 거의 유명한 유적을 보기위한 을 가보려고합니다 초등학생에겐 경주여행 만큼 도움되는 등 150 000원대 전후로 투숙 가능 경주여행 시티투어 홈페이지 천마관광 www cmtour net 문 의 054 743 6001 
경주여행	154	 경주 여행  숙박 문의드립니다.	https://kin.naver.com/qna/detail.naver?d1id=9&dirId=90111&docId=455881791&qb=6rK97KO87Jes7ZaJ&enc=utf8	 저희 어머니 칠순이 10월 중순이라 경주 여행 3박 4일정도 예정입니다 인원은 성인 5명 어린이 3명으로 8명인데 숙박 검색해보니 금액대가 만만치가 않더군요 저희 8인 가족이 숙박할 수 있는 곳으로 추천 부탁합니다 	 경주 여행  숙박 문의드립니다.  저희 어머니 칠순이 10월 중순이라 경주 여행 3박 4일정도 예정입니다 인원은 성인 5명 어린이 3명으로 8명인데 숙박 검색해보니 금액대가 만만치가 않더군요 저희 8인 가족이 숙박할 수 있는 곳으로 추천 부탁합니다 
경주여행	155	외도- 경주 여행 ..	https://kin.naver.com/qna/detail.naver?d1id=9&dirId=90111&docId=74587144&qb=6rK97KO87Jes7ZaJ&enc=utf8	 이튿날 경주여행 을 하고 또 하룻밤 자고 원주로 오는 일정입니다 제가 궁굼한거는 여행경비를 알고 경주여행 부산대동요금소 경주IC 70 8Km 3 600원 약 50분소요 경주에 도착하면 숙소를 잡으세요 보문내에는 	외도- 경주 여행 ..  이튿날 경주여행 을 하고 또 하룻밤 자고 원주로 오는 일정입니다 제가 궁굼한거는 여행경비를 알고 경주여행 부산대동요금소 경주IC 70 8Km 3 600원 약 50분소요 경주에 도착하면 숙소를 잡으세요 보문내에는 
경주여행	156	 경주 여행  코스	https://kin.naver.com/qna/detail.naver?d1id=12&dirId=121102&docId=295358524&qb=6rK97KO87Jes7ZaJ&enc=utf8	3월 중순에 친구들과 차를 렌트하여 경주 여행 을 하고 안녕하세요 경주여행 을 계획하시는군요 우선 몇 박 또한 제가 경주 여행 할때 느꼈던 점이 생각보다 일찍 가족들과 경주 여행 시 한 번쯤 들리면 좋은 곳이다 	 경주 여행  코스 3월 중순에 친구들과 차를 렌트하여 경주 여행 을 하고 안녕하세요 경주여행 을 계획하시는군요 우선 몇 박 또한 제가 경주 여행 할때 느꼈던 점이 생각보다 일찍 가족들과 경주 여행 시 한 번쯤 들리면 좋은 곳이다 
경주여행	157	가족 경주여행  일정 및 유의사항(?)을 알려주세요...	https://kin.naver.com/qna/detail.naver?d1id=9&dirId=90111&docId=60087839&qb=6rK97KO87Jes7ZaJ&enc=utf8	 가족 경주여행 을 다녀오려고 합니다 큰아이가 초등학교 2학년인데 요즘 역사에 관심이 많아서 경주여행 을 그리고 경주여행 이 수학여행 이후로 첨이라 여행시 좋은 답변에는 추가내공 드리겠습니다 4박5일의 경주 여행 이 	가족 경주여행  일정 및 유의사항(?)을 알려주세요...  가족 경주여행 을 다녀오려고 합니다 큰아이가 초등학교 2학년인데 요즘 역사에 관심이 많아서 경주여행 을 그리고 경주여행 이 수학여행 이후로 첨이라 여행시 좋은 답변에는 추가내공 드리겠습니다 4박5일의 경주 여행 이 
경주여행	158	 경주여행 가기	https://kin.naver.com/qna/detail.naver?d1id=9&dirId=90111&docId=460733045&qb=6rK97KO87Jes7ZaJ&enc=utf8	안녕하세요 경주 여행 을 2024 기준으로 중1친구들 4명에서 가려고 하는데 황리단길이랑 가까운 숙소 예약 가능한 곳이 있을까요 안녕하세요 경주마벨라풀빌라 스크린골프 입니다 독채69평형 개별수영장 바베큐장 	 경주여행 가기 안녕하세요 경주 여행 을 2024 기준으로 중1친구들 4명에서 가려고 하는데 황리단길이랑 가까운 숙소 예약 가능한 곳이 있을까요 안녕하세요 경주마벨라풀빌라 스크린골프 입니다 독채69평형 개별수영장 바베큐장 
경주여행	159	 경주 여행 을 가려고 하는데요,	https://kin.naver.com/qna/detail.naver?d1id=9&dirId=90111&docId=74279907&qb=6rK97KO87Jes7ZaJ&enc=utf8	전 수도권에 살고 있고요 이번에 경주여행 을 가볼 생각입니다 월성터를 비롯한 신라유적지를 둘러보고 경주여행 터미날 또는 경주역에서 이동시에는 10번 버스를 이용하면 편리 합니다 10번 터미날 경주역 	 경주 여행 을 가려고 하는데요, 전 수도권에 살고 있고요 이번에 경주여행 을 가볼 생각입니다 월성터를 비롯한 신라유적지를 둘러보고 경주여행 터미날 또는 경주역에서 이동시에는 10번 버스를 이용하면 편리 합니다 10번 터미날 경주역 
경주여행	160	 경주여행 질문	https://kin.naver.com/qna/detail.naver?d1id=9&dirId=90111&docId=149630194&qb=6rK97KO87Jes7ZaJ&enc=utf8	 3박4일동안 경주여행 을 할려고 합니다 자가용을 가지고 또하나는 경주여행 팁이나 코스를 알려주시면 정말 감사하겠습니다 경주여행 을 계획하시는군요 휴양이 저렴한 숙박을 원하신다면 경주여행 게스트하우스 추천해 	 경주여행 질문  3박4일동안 경주여행 을 할려고 합니다 자가용을 가지고 또하나는 경주여행 팁이나 코스를 알려주시면 정말 감사하겠습니다 경주여행 을 계획하시는군요 휴양이 저렴한 숙박을 원하신다면 경주여행 게스트하우스 추천해 
경주여행	161	 경주여행  코스 질문	https://kin.naver.com/qna/detail.naver?d1id=9&dirId=90101&docId=477420197&qb=6rK97KO87Jes7ZaJ&enc=utf8	 월지 야경 중앙시장 3일차 보문단지권 경주월드 루지공원 카트라이더 엑스포공원 솔거미술관 동궁원 식물원 버드파크 경주 여행 관련해서 참고할만한 포스팅 남겨봅니다 	 경주여행  코스 질문  월지 야경 중앙시장 3일차 보문단지권 경주월드 루지공원 카트라이더 엑스포공원 솔거미술관 동궁원 식물원 버드파크 경주 여행 관련해서 참고할만한 포스팅 남겨봅니다 
경주여행	162	 경주여행  문의드려요.	https://kin.naver.com/qna/detail.naver?d1id=9&dirId=90111&docId=128051003&qb=6rK97KO87Jes7ZaJ&enc=utf8	1박 2일로 경주여행 가려고 하는데요 첫날 경주에 도착하면 많은 답변 부탁드려요 0 경주여행 일정과 형편에 맞게 054 743 6001 아래사이트에서 경주여행 후기 몇편만 읽어보면 많은 도움이 될것입니다 좋은 경주여행 다녀 	 경주여행  문의드려요. 1박 2일로 경주여행 가려고 하는데요 첫날 경주에 도착하면 많은 답변 부탁드려요 0 경주여행 일정과 형편에 맞게 054 743 6001 아래사이트에서 경주여행 후기 몇편만 읽어보면 많은 도움이 될것입니다 좋은 경주여행 다녀 
경주여행	163	 경주여행 -8월7일	https://kin.naver.com/qna/detail.naver?d1id=9&dirId=90111&docId=114506991&qb=6rK97KO87Jes7ZaJ&enc=utf8	 작은애 6살 경주 여행 을 계획하고 있습니다 도통 일정을 짜기가 가보시면 아시겠지만 경주 여행 하는 사람들 거의 대부분 스템프 가지고 그리고 제가 경주 여행 다녀온 후에 블로그에 올린 사진들입니다 즐거운 여행 	 경주여행 -8월7일  작은애 6살 경주 여행 을 계획하고 있습니다 도통 일정을 짜기가 가보시면 아시겠지만 경주 여행 하는 사람들 거의 대부분 스템프 가지고 그리고 제가 경주 여행 다녀온 후에 블로그에 올린 사진들입니다 즐거운 여행 
경주여행	164	 경주 여행 코스 질문이요!!	https://kin.naver.com/qna/detail.naver?d1id=12&dirId=12110212&docId=225460658&qb=6rK97KO87Jes7ZaJ&enc=utf8	안녕하세요 경주여행 을 할려고하는데요 경남진주에서 출발해서 경주에 당일치기로 친구들이랑 여행을 가기로 경주 여행 코스에 대한 생각입니다 안녕하세요 여행전문블로거 쭈니아빠입니다 아침일찍 출발해서 오전에 경주에 	 경주 여행 코스 질문이요!! 안녕하세요 경주여행 을 할려고하는데요 경남진주에서 출발해서 경주에 당일치기로 친구들이랑 여행을 가기로 경주 여행 코스에 대한 생각입니다 안녕하세요 여행전문블로거 쭈니아빠입니다 아침일찍 출발해서 오전에 경주에 
경주여행	165	 경주여행  중 대형택시 (8명정도)	https://kin.naver.com/qna/detail.naver?d1id=8&dirId=81207&docId=485979818&qb=6rK97KO87Jes7ZaJ&enc=utf8	경주에 단체로 기차를 타고 갑니다 경주 시내 황리단길 숙소 천북면 까지 대형택시가 8명정도 탑승 해야함 있을까요 그 다음 날 다시 숙소 천북면 경주 시내 황리단길 이용 예정 일요일에 퇴실 후 다시 이용도 해야합니다 	 경주여행  중 대형택시 (8명정도) 경주에 단체로 기차를 타고 갑니다 경주 시내 황리단길 숙소 천북면 까지 대형택시가 8명정도 탑승 해야함 있을까요 그 다음 날 다시 숙소 천북면 경주 시내 황리단길 이용 예정 일요일에 퇴실 후 다시 이용도 해야합니다 
경주여행	166	 경주여행 을 하는게 숙소 괜찮을까요	https://kin.naver.com/qna/detail.naver?d1id=9&dirId=90111&docId=390639707&qb=6rK97KO87Jes7ZaJ&enc=utf8	 경주 여행 을 가는데 경주 월드 기준으로 숙소를 잡으려고 합니다 근데 거리가 경주여행 을 정말 많이많이 다니고 있는 쭈니아빠입니다 솔직하게 경주여행 코스가 며칠일지 모르겠지만 굳이 1시간 이동해야 되는 숙소를 잡은 	 경주여행 을 하는게 숙소 괜찮을까요  경주 여행 을 가는데 경주 월드 기준으로 숙소를 잡으려고 합니다 근데 거리가 경주여행 을 정말 많이많이 다니고 있는 쭈니아빠입니다 솔직하게 경주여행 코스가 며칠일지 모르겠지만 굳이 1시간 이동해야 되는 숙소를 잡은 
