query	no	title	link	description	total_text
경주여행	367	 경주여행 코스 순서	https://kin.naver.com/qna/detail.naver?d1id=12&dirId=121102&docId=293981463&qb=6rK97KO87Jes7ZaJ&enc=utf8	 경주여행 을 가려고하는데요 콜로세움 황리단길 안압지 첨성대 추억의달동네 를 가려고 하는데 시외버스터미널에서 내리면 경로상 순서를 어떻게 짜는게 좋을까요 도와주세용 안녕하세요 macham입니다 경주시 	 경주여행 코스 순서  경주여행 을 가려고하는데요 콜로세움 황리단길 안압지 첨성대 추억의달동네 를 가려고 하는데 시외버스터미널에서 내리면 경로상 순서를 어떻게 짜는게 좋을까요 도와주세용 안녕하세요 macham입니다 경주시 
경주여행	368	 경주여행  가려는데 여행코스 어케 잡아야 할까요 ?	https://kin.naver.com/qna/detail.naver?d1id=9&dirId=90111&docId=131443517&qb=6rK97KO87Jes7ZaJ&enc=utf8	 경주여행 을 이번주 주말쯤에 친구들이랑 다녀오려고 하는데요 경주여행 코스를 어케 잡아야 경주 여행 코스 추천 부탁드려요 보문단지 근처로 추천해 주시면 좋을듯 하네요 경주여행 을 이번주 주말쯤에 	 경주여행  가려는데 여행코스 어케 잡아야 할까요 ?  경주여행 을 이번주 주말쯤에 친구들이랑 다녀오려고 하는데요 경주여행 코스를 어케 잡아야 경주 여행 코스 추천 부탁드려요 보문단지 근처로 추천해 주시면 좋을듯 하네요 경주여행 을 이번주 주말쯤에 
경주여행	369	 경주 여행  코스	https://kin.naver.com/qna/detail.naver?d1id=9&dirId=90111&docId=340807078&qb=6rK97KO87Jes7ZaJ&enc=utf8	 경주 여행 코스좀 알려주세요 저희가 차가 없어서 부산에서 시외버스나 srt타고 가려고 합니다 1 경주버스터미널 근처 경주월드까지 하나씩 둘러볼만한 코스 2 신경주역 근처 경주월드까지 코스 저희가 저는 면허가 없어서 둘 다 	 경주 여행  코스  경주 여행 코스좀 알려주세요 저희가 차가 없어서 부산에서 시외버스나 srt타고 가려고 합니다 1 경주버스터미널 근처 경주월드까지 하나씩 둘러볼만한 코스 2 신경주역 근처 경주월드까지 코스 저희가 저는 면허가 없어서 둘 다 
경주여행	370	아이들과2박3일 경주여행 	https://kin.naver.com/qna/detail.naver?d1id=9&dirId=90111&docId=364939415&qb=6rK97KO87Jes7ZaJ&enc=utf8	 그쪽에 있는데 어디를 어찌가야하는지 모르겠어서 여쭤봅니다 1일차는 어디어디 이런식으로 좀 부탁드립니다 자세히 추천 부탁드립니다 첫 경주 여행 인데 알차게 보내고싶어요 아이들 나이는 9세7세4세 입니다 안녕하세요 	아이들과2박3일 경주여행   그쪽에 있는데 어디를 어찌가야하는지 모르겠어서 여쭤봅니다 1일차는 어디어디 이런식으로 좀 부탁드립니다 자세히 추천 부탁드립니다 첫 경주 여행 인데 알차게 보내고싶어요 아이들 나이는 9세7세4세 입니다 안녕하세요 
경주여행	371	 경주여행  , 버스	https://kin.naver.com/qna/detail.naver?d1id=9&dirId=90111&docId=369274389&qb=6rK97KO87Jes7ZaJ&enc=utf8	안녕하세요 경주여행 을 계획중인데요 100번 100 1번 10번 버스 이용할건데 배차시간이 각각 35분 20분씩 이라고는 하는데 버스어플로보면 정보없음으로만 뜨네요 배차시간에 맞게 오는건가요 뚜벅이라서 	 경주여행  , 버스 안녕하세요 경주여행 을 계획중인데요 100번 100 1번 10번 버스 이용할건데 배차시간이 각각 35분 20분씩 이라고는 하는데 버스어플로보면 정보없음으로만 뜨네요 배차시간에 맞게 오는건가요 뚜벅이라서 
경주여행	372	 경주여행  버스질문	https://kin.naver.com/qna/detail.naver?d1id=12&dirId=121102&docId=148024606&qb=6rK97KO87Jes7ZaJ&enc=utf8	4월둘째주 금요일날 2박3일로 경주여행 을 할려고 합니다 서울역에서 6시반에 출발해서 8시 45분에 도착하는데요 도착하자마자 1박2일에 나왔던 경주남산에 바로 등반하고 싶습니다 신경주역에서 어떤 버스를 타야 	 경주여행  버스질문 4월둘째주 금요일날 2박3일로 경주여행 을 할려고 합니다 서울역에서 6시반에 출발해서 8시 45분에 도착하는데요 도착하자마자 1박2일에 나왔던 경주남산에 바로 등반하고 싶습니다 신경주역에서 어떤 버스를 타야 
경주여행	373	2박3일  경주여행  일정	https://kin.naver.com/qna/detail.naver?d1id=9&dirId=901&docId=256869722&qb=6rK97KO87Jes7ZaJ&enc=utf8	이번 여름휴가에 경주 여행 을 할까 생각중입니다 경주는 97년 쯤 수학여행으로 가보고 처음입니다 부부와 6살5살 딸둘 친정부모님 이렇게 갈 예정입니다 아이와 어른 모두 만족할만한 코스좀 추천 부탁드립니다 출발지는 강원도 	2박3일  경주여행  일정 이번 여름휴가에 경주 여행 을 할까 생각중입니다 경주는 97년 쯤 수학여행으로 가보고 처음입니다 부부와 6살5살 딸둘 친정부모님 이렇게 갈 예정입니다 아이와 어른 모두 만족할만한 코스좀 추천 부탁드립니다 출발지는 강원도 
경주여행	374	 경주 여행  대중교통으로	https://kin.naver.com/qna/detail.naver?d1id=9&dirId=90111&docId=248852630&qb=6rK97KO87Jes7ZaJ&enc=utf8	5월에 경주여행 을 하려합니다 대중교통으로만 다니려하는데 편한 순서좀 알려주세요 출발지는 바람곳 게하 입니다 아침부터 하루만에 다녀오려하는데 괜찮을지 모르겠네요 보문 콜로세움 교촌마을 	 경주 여행  대중교통으로 5월에 경주여행 을 하려합니다 대중교통으로만 다니려하는데 편한 순서좀 알려주세요 출발지는 바람곳 게하 입니다 아침부터 하루만에 다녀오려하는데 괜찮을지 모르겠네요 보문 콜로세움 교촌마을 
경주여행	375	 경주 여행 (경주 문화재)	https://kin.naver.com/qna/detail.naver?d1id=13&dirId=130102&docId=136455661&qb=6rK97KO87Jes7ZaJ&enc=utf8	 전 초5 인데여 제가 좀만있음 경주여행 에 가거든여 그래서 경주 문화재 유적지같은거 공부좀하려고하는데 자세히나와있는걸 찾기가 쉽지 않네여 좀 도와주세요 1 만든이 2 만든 날짜 3 시대 4 종목 예 국보 제0호 5 지정일 7 	 경주 여행 (경주 문화재)  전 초5 인데여 제가 좀만있음 경주여행 에 가거든여 그래서 경주 문화재 유적지같은거 공부좀하려고하는데 자세히나와있는걸 찾기가 쉽지 않네여 좀 도와주세요 1 만든이 2 만든 날짜 3 시대 4 종목 예 국보 제0호 5 지정일 7 
경주여행	376	 경주 여행  코스 질문	https://kin.naver.com/qna/detail.naver?d1id=12&dirId=121102&docId=305859205&qb=6rK97KO87Jes7ZaJ&enc=utf8	하루동안 여자친구랑 경주 여행 을 하려고 하는데요 차도 없고 교통수단은 불편할것 같은데 최대한 가깝게 코스를 추억의 달동네 오정 캘리포니아비치 오후 가장 더운시간 키덜트 뮤지엄 오후 중양야시장 저녁 즐거운 경주 여행 	 경주 여행  코스 질문 하루동안 여자친구랑 경주 여행 을 하려고 하는데요 차도 없고 교통수단은 불편할것 같은데 최대한 가깝게 코스를 추억의 달동네 오정 캘리포니아비치 오후 가장 더운시간 키덜트 뮤지엄 오후 중양야시장 저녁 즐거운 경주 여행 
경주여행	377	 경주 여행 	https://kin.naver.com/qna/detail.naver?d1id=9&dirId=90111&docId=388821495&qb=6rK97KO87Jes7ZaJ&enc=utf8	당일치기로 경주여행 갈건데요 대릉원 천마총 황리단길 동궁과월지 첨성대 이렇게 갈거에요 시외버스터미널도착 뚜벅이로 갈건데 코스를 어떻게하는게 편할까요 이동이 많이 힘들면 자전거 대여도 생각하고있는데 대여하는게 	 경주 여행  당일치기로 경주여행 갈건데요 대릉원 천마총 황리단길 동궁과월지 첨성대 이렇게 갈거에요 시외버스터미널도착 뚜벅이로 갈건데 코스를 어떻게하는게 편할까요 이동이 많이 힘들면 자전거 대여도 생각하고있는데 대여하는게 
경주여행	378	 경주여행  황리단길 이요	https://kin.naver.com/qna/detail.naver?d1id=9&dirId=90111&docId=483731696&qb=6rK97KO87Jes7ZaJ&enc=utf8	체크인이 3시 던데 경주에는 10시쯤 도착할 것 같아요 그전에 밥먹고 카페 갔다가 산책하고 숙소 가면 될 것 같은데 캐리어를 어디에 맡겨야 좋을지 몰라서요 보관해주는곳이 있을까요 황리단길에 경주가는 즉시 숙소로 가시어 짐을 	 경주여행  황리단길 이요 체크인이 3시 던데 경주에는 10시쯤 도착할 것 같아요 그전에 밥먹고 카페 갔다가 산책하고 숙소 가면 될 것 같은데 캐리어를 어디에 맡겨야 좋을지 몰라서요 보관해주는곳이 있을까요 황리단길에 경주가는 즉시 숙소로 가시어 짐을 
경주여행	379	 경주여행  갈건데 어디갈지 추천좀요	https://kin.naver.com/qna/detail.naver?d1id=9&dirId=90111&docId=467084860&qb=6rK97KO87Jes7ZaJ&enc=utf8	 경주 여행 을 계획하신다니 기쁘네요 친구들과 함께라면 아래의 장소들을 추천드립니다 불국사 유네스코 세계문화유산으로 지정된 이 멋진 사찰은 한국 사찰 건축의 걸작입니다 석굴암 불국사와 함께 또 다른 유네스코 	 경주여행  갈건데 어디갈지 추천좀요  경주 여행 을 계획하신다니 기쁘네요 친구들과 함께라면 아래의 장소들을 추천드립니다 불국사 유네스코 세계문화유산으로 지정된 이 멋진 사찰은 한국 사찰 건축의 걸작입니다 석굴암 불국사와 함께 또 다른 유네스코 
경주여행	380	2박 3일  경주여행  일정 잡아주세요	https://kin.naver.com/qna/detail.naver?d1id=9&dirId=90111&docId=74066126&qb=6rK97KO87Jes7ZaJ&enc=utf8	2박 3일동안 친구들이랑 모여 경주여행 하려고 합니다 일정보고 차를 렌터를 할지 아님 택시를 타고다닐지 결정할꺼구요 둘째날에는 경주월드 갈꺼라서 그것까지 포함해서 일정 좀 잡아주세요 아 자전거 하이킹도 하려고 	2박 3일  경주여행  일정 잡아주세요 2박 3일동안 친구들이랑 모여 경주여행 하려고 합니다 일정보고 차를 렌터를 할지 아님 택시를 타고다닐지 결정할꺼구요 둘째날에는 경주월드 갈꺼라서 그것까지 포함해서 일정 좀 잡아주세요 아 자전거 하이킹도 하려고 
경주여행	381	 경주 여행 	https://kin.naver.com/qna/detail.naver?d1id=9&dirId=90111&docId=346848885&qb=6rK97KO87Jes7ZaJ&enc=utf8	제가 내일 경주여행 을 당일치기로 가는데 지금 코로나 때문에 어떻게 해야할지 고민이에요 코로나 때문에 고민이신가보네여 저도 이번에 친구들이랑 펜션 가려고 했는데 어떻게 할까 많이 고민중입니다 경상도는 아직 확진자가 	 경주 여행  제가 내일 경주여행 을 당일치기로 가는데 지금 코로나 때문에 어떻게 해야할지 고민이에요 코로나 때문에 고민이신가보네여 저도 이번에 친구들이랑 펜션 가려고 했는데 어떻게 할까 많이 고민중입니다 경상도는 아직 확진자가 
경주여행	382	 경주여행 (1박2일코스)	https://kin.naver.com/qna/detail.naver?d1id=12&dirId=121102&docId=297319893&qb=6rK97KO87Jes7ZaJ&enc=utf8	4월6일 금 조치원에서 경주로 8시경 출발하여 4월7일 토 12시경 경주에서 조치원으로 돌아오는 1박2일 경주여행 을 대릉원 첨성대 교촌마을 박물관 야경 안압지 첨성대 월성 석빙고 분황사 등등 즐거운 경주 여행 하세요 	 경주여행 (1박2일코스) 4월6일 금 조치원에서 경주로 8시경 출발하여 4월7일 토 12시경 경주에서 조치원으로 돌아오는 1박2일 경주여행 을 대릉원 첨성대 교촌마을 박물관 야경 안압지 첨성대 월성 석빙고 분황사 등등 즐거운 경주 여행 하세요 
경주여행	383	1박2일  경주여행  추천	https://kin.naver.com/qna/detail.naver?d1id=12&dirId=121102&docId=79497640&qb=6rK97KO87Jes7ZaJ&enc=utf8	 주말에 1박 2일 정도 시간내서 친구와 경주여행 생각중인데요 경주는 초등학교 수학여행 이후로 처음이라 어떻게 계획을 짜야 할지 모르겠네요 우선 꼭 들려 보고 싶은 곳은 불국사 첨성대 안압지 천마총 경주타워 	1박2일  경주여행  추천  주말에 1박 2일 정도 시간내서 친구와 경주여행 생각중인데요 경주는 초등학교 수학여행 이후로 처음이라 어떻게 계획을 짜야 할지 모르겠네요 우선 꼭 들려 보고 싶은 곳은 불국사 첨성대 안압지 천마총 경주타워 
경주여행	384	 경주여행 하는데요 숙박때문에요	https://kin.naver.com/qna/detail.naver?d1id=12&dirId=121102&docId=106071153&qb=6rK97KO87Jes7ZaJ&enc=utf8	여인네 4명이 1박2일로 경주여행 을 가려고 합니다 주말 토 일루요 그런데 정말 암껏두 몰라서요 서울에서 기차를 타면 KTX로 타야할듯한데 한번에 가는게 없는거 같더라구요 그런것도 모르고 기차 비용은 얼마인지 시간은 	 경주여행 하는데요 숙박때문에요 여인네 4명이 1박2일로 경주여행 을 가려고 합니다 주말 토 일루요 그런데 정말 암껏두 몰라서요 서울에서 기차를 타면 KTX로 타야할듯한데 한번에 가는게 없는거 같더라구요 그런것도 모르고 기차 비용은 얼마인지 시간은 
경주여행	385	[경주] 경주 여행 	https://kin.naver.com/qna/detail.naver?d1id=9&dirId=90109&docId=157764346&qb=6rK97KO87Jes7ZaJ&enc=utf8	 경주 여행 을 가는데 계획표좀 짜 주세요 첨성대와 불국사도 좋구요 그 경주의 에멜레 종이 있는 선덕여왕 드라마 있어요 제가 경주에 갔다와밨는데 천마총이나 계림숲에 가보시는것도 좋아요 좋은 경주여행 대세요 채택 해주세요 	[경주] 경주 여행   경주 여행 을 가는데 계획표좀 짜 주세요 첨성대와 불국사도 좋구요 그 경주의 에멜레 종이 있는 선덕여왕 드라마 있어요 제가 경주에 갔다와밨는데 천마총이나 계림숲에 가보시는것도 좋아요 좋은 경주여행 대세요 채택 해주세요 
경주여행	386	 경주여행  민박 편션 추천 좀	https://kin.naver.com/qna/detail.naver?d1id=9&dirId=90111&docId=177039738&qb=6rK97KO87Jes7ZaJ&enc=utf8	가족들과 휴가 겸 경주여행 준비 중입니다 자연경관이 어우러진 가격이 저렴한 민박이나 팬션 추천 좀 부탁드립니다 지난봄 다녀온 경주 초당방 민박을 한번 알아보세요 경주 시내에서 30분정도 거리에 있고요 보문단지에서 	 경주여행  민박 편션 추천 좀 가족들과 휴가 겸 경주여행 준비 중입니다 자연경관이 어우러진 가격이 저렴한 민박이나 팬션 추천 좀 부탁드립니다 지난봄 다녀온 경주 초당방 민박을 한번 알아보세요 경주 시내에서 30분정도 거리에 있고요 보문단지에서 
경주여행	387	 경주여행  일정 짜주세요~	https://kin.naver.com/qna/detail.naver?d1id=9&dirId=90111&docId=75360166&qb=6rK97KO87Jes7ZaJ&enc=utf8	곧 신랑이랑 경주여행 을 해보려고 하는데요 경주쪽 사시는 분 있음 일정 추천 좀 부탁드려요 대명콘도에 숙소를 잡을거구요 1박2일로 움직일 예정이랍니다 국립경주박물관 첨성대 안압지 불국사 석굴암 대릉원 천마총 이곳은 꼭 	 경주여행  일정 짜주세요~ 곧 신랑이랑 경주여행 을 해보려고 하는데요 경주쪽 사시는 분 있음 일정 추천 좀 부탁드려요 대명콘도에 숙소를 잡을거구요 1박2일로 움직일 예정이랍니다 국립경주박물관 첨성대 안압지 불국사 석굴암 대릉원 천마총 이곳은 꼭 
경주여행	388	1박2일  경주여행 ~	https://kin.naver.com/qna/detail.naver?d1id=12&dirId=121102&docId=155459801&qb=6rK97KO87Jes7ZaJ&enc=utf8	안녕하세요 1박 2일로 경주 여행 계획중입니다 낮 12시에 불국사역에 도착 예정이구요 다음날 경주역에서 오후 5시 기차를 타고 돌아올 예정입니다 안압지 야경은 꼭 필수로 보고싶고 불국사와 석굴암도 보고싶어요 자전거 타고 경주 	1박2일  경주여행 ~ 안녕하세요 1박 2일로 경주 여행 계획중입니다 낮 12시에 불국사역에 도착 예정이구요 다음날 경주역에서 오후 5시 기차를 타고 돌아올 예정입니다 안압지 야경은 꼭 필수로 보고싶고 불국사와 석굴암도 보고싶어요 자전거 타고 경주 
경주여행	389	혼자  경주여행  어때요?	https://kin.naver.com/qna/detail.naver?d1id=9&dirId=90111&docId=420114186&qb=6rK97KO87Jes7ZaJ&enc=utf8	저 혼자 경주 당일치기 다녀올려는데 별론가요 경주여행 좋은거 같아요 볼거리 먹거리도 많아서 다니기 좋아요 혼자다닌다고 외롭지 않아요 동행자 눈치볼필요도 없고 편할거예요	혼자  경주여행  어때요? 저 혼자 경주 당일치기 다녀올려는데 별론가요 경주여행 좋은거 같아요 볼거리 먹거리도 많아서 다니기 좋아요 혼자다닌다고 외롭지 않아요 동행자 눈치볼필요도 없고 편할거예요
경주여행	390	 경주여행 //	https://kin.naver.com/qna/detail.naver?d1id=12&dirId=121102&docId=105686906&qb=6rK97KO87Jes7ZaJ&enc=utf8	남자 3명이서 경주 여행 을갈려는데 숙박하는곳하고 추천지 노는곳 등 쫌 알려주세요 가격두 안녕하세요 저는 경주가 고향인 서울에 살고있는 처녀랍니다 서울에서 KTX 타고 오면 대구에서 내려 또 버스나 기차를 	 경주여행 // 남자 3명이서 경주 여행 을갈려는데 숙박하는곳하고 추천지 노는곳 등 쫌 알려주세요 가격두 안녕하세요 저는 경주가 고향인 서울에 살고있는 처녀랍니다 서울에서 KTX 타고 오면 대구에서 내려 또 버스나 기차를 
경주여행	391	 경주여행 ,경주숙소 추천해주세요 내공100	https://kin.naver.com/qna/detail.naver?d1id=9&dirId=90111&docId=379234390&qb=6rK97KO87Jes7ZaJ&enc=utf8	 경주에 여행지가 많다보니 숙소를 경주에 잡으려고하는데 경주여행 지랑 경주숙소 추천해주세요 개별 수영장 개별 바비큐장 개별스파 까지 프라이빗 하게 즐길수있는 오푸스11풀빌라 강추합니다 광고 영상 감상 하시져 	 경주여행 ,경주숙소 추천해주세요 내공100  경주에 여행지가 많다보니 숙소를 경주에 잡으려고하는데 경주여행 지랑 경주숙소 추천해주세요 개별 수영장 개별 바비큐장 개별스파 까지 프라이빗 하게 즐길수있는 오푸스11풀빌라 강추합니다 광고 영상 감상 하시져 
경주여행	392	 경주여행 &quot;	https://kin.naver.com/qna/detail.naver?d1id=9&dirId=90111&docId=285508160&qb=6rK97KO87Jes7ZaJ&enc=utf8	추석연휴 경주여행 을 가려는데요 숙소를 못구해서요 경주에 저렴한 가족4인 지낼수있는 게스트하우스나 아님 찜질방 암튼 추천좀 부탁드립니다 경주는 관광지답게 숙소천국입니다 리조트는 저렴하게 할인 자주 하구요 	 경주여행 &quot; 추석연휴 경주여행 을 가려는데요 숙소를 못구해서요 경주에 저렴한 가족4인 지낼수있는 게스트하우스나 아님 찜질방 암튼 추천좀 부탁드립니다 경주는 관광지답게 숙소천국입니다 리조트는 저렴하게 할인 자주 하구요 
경주여행	393	 경주 여행  관련 질문	https://kin.naver.com/qna/detail.naver?d1id=9&dirId=90111&docId=290548473&qb=6rK97KO87Jes7ZaJ&enc=utf8	제가 이번에 가족과 함께 경주로 여행을 가려고 합니다 근데 이런 여행코스를 짜는 것이 힘들고 고민되서 이렇게 지식인 여러분께 도움을 구합니다 경주여행 추천코스를 추천해주실수 있으십니까 님의경우는 경주여행 이 당일인가요 	 경주 여행  관련 질문 제가 이번에 가족과 함께 경주로 여행을 가려고 합니다 근데 이런 여행코스를 짜는 것이 힘들고 고민되서 이렇게 지식인 여러분께 도움을 구합니다 경주여행 추천코스를 추천해주실수 있으십니까 님의경우는 경주여행 이 당일인가요 
경주여행	394	일본인 친구  경주 여행 	https://kin.naver.com/qna/detail.naver?d1id=9&dirId=90111&docId=462449942&qb=6rK97KO87Jes7ZaJ&enc=utf8	 경주여행 코스로 경주박물관을 추천드립니다 경주 박물관은 입장료가 무료이며 10시부터 입장하실 수 있어요 식사는 택시로 7분 거리에 경주 황리단길이 있어서 경주십원빵도 즐기실 수 있고 다양한 음식도 드실 수 있답니다 	일본인 친구  경주 여행   경주여행 코스로 경주박물관을 추천드립니다 경주 박물관은 입장료가 무료이며 10시부터 입장하실 수 있어요 식사는 택시로 7분 거리에 경주 황리단길이 있어서 경주십원빵도 즐기실 수 있고 다양한 음식도 드실 수 있답니다 
경주여행	395	 경주 여행  숙박 어디로 잡을지 문의좀	https://kin.naver.com/qna/detail.naver?d1id=9&dirId=90111&docId=450526627&qb=6rK97KO87Jes7ZaJ&enc=utf8	 경주 여행 을 계획하시는 것 같네요 경주는 정말 아름다운 곳이에요 휴가철에 경주 인파가 많이 몰리지는 않지만 여름 휴가 때는 관광객들로 북적이는 편이에요 그래도 한산한 편이라고 볼 수 있어요 그럼 숙박을 어디로 잡아야 	 경주 여행  숙박 어디로 잡을지 문의좀  경주 여행 을 계획하시는 것 같네요 경주는 정말 아름다운 곳이에요 휴가철에 경주 인파가 많이 몰리지는 않지만 여름 휴가 때는 관광객들로 북적이는 편이에요 그래도 한산한 편이라고 볼 수 있어요 그럼 숙박을 어디로 잡아야 
경주여행	396	 경주여행  질문합니다!	https://kin.naver.com/qna/detail.naver?d1id=9&dirId=90111&docId=131677364&qb=6rK97KO87Jes7ZaJ&enc=utf8	 4 자전거 렌탈을해서 경주여행 을 할려고 하니 막막하네요 어딜 둘러봐야할지 여행코스좀 추천 부탁드려요 5 자전거 렌탈 경주 여행 지 추천 네 저가 점번에 서울에서 오신 첨보는 누나를 추천해드렷습니다 첨성대 	 경주여행  질문합니다!  4 자전거 렌탈을해서 경주여행 을 할려고 하니 막막하네요 어딜 둘러봐야할지 여행코스좀 추천 부탁드려요 5 자전거 렌탈 경주 여행 지 추천 네 저가 점번에 서울에서 오신 첨보는 누나를 추천해드렷습니다 첨성대 
경주여행	397	 경주 여행 	https://kin.naver.com/qna/detail.naver?d1id=12&dirId=121102&docId=284223295&qb=6rK97KO87Jes7ZaJ&enc=utf8	친구들 6명 7명 과 경주 여행 을 가려고 합니다 교촌마을 콜로세움 황성공원 안압지 야경 첨성대 야경 등 어떤 경주여행 을 환영합니다 우선 비용 절감 및 친구들과 걸어면서 추억 만들기에는 시내버스 이용 추천 합니다 1일차 	 경주 여행  친구들 6명 7명 과 경주 여행 을 가려고 합니다 교촌마을 콜로세움 황성공원 안압지 야경 첨성대 야경 등 어떤 경주여행 을 환영합니다 우선 비용 절감 및 친구들과 걸어면서 추억 만들기에는 시내버스 이용 추천 합니다 1일차 
경주여행	398	 경주 여행 지 추천	https://kin.naver.com/qna/detail.naver?d1id=9&dirId=90111&docId=318575361&qb=6rK97KO87Jes7ZaJ&enc=utf8	저희 가족이 이번 주멀에 경주 여행 을 가는데요 좋은 여행지 추천좀 부탁드려요 뭐 대표적인 곳은 신라 유적이겠지만 저희가 토요일 아침에 김천에서 경주까지 가는데 한 2시간 정도 걸린다 치면 토요일 당일날 할 수 있는 건 	 경주 여행 지 추천 저희 가족이 이번 주멀에 경주 여행 을 가는데요 좋은 여행지 추천좀 부탁드려요 뭐 대표적인 곳은 신라 유적이겠지만 저희가 토요일 아침에 김천에서 경주까지 가는데 한 2시간 정도 걸린다 치면 토요일 당일날 할 수 있는 건 
경주여행	399	 경주여행 을 가려고 하는데용	https://kin.naver.com/qna/detail.naver?d1id=9&dirId=90111&docId=325587246&qb=6rK97KO87Jes7ZaJ&enc=utf8	 경주여행 을 가려고 하는데용 황리단길이랑 교촌마을 대릉원이 같이 모여져있는건가요 경주 맛집있으면 추천해주세요 안녕하세요 경주 맛집이 궁금하시다고요 그런 고민은 이제 안 하셔도 됩니다 경주사람들 이라는 	 경주여행 을 가려고 하는데용  경주여행 을 가려고 하는데용 황리단길이랑 교촌마을 대릉원이 같이 모여져있는건가요 경주 맛집있으면 추천해주세요 안녕하세요 경주 맛집이 궁금하시다고요 그런 고민은 이제 안 하셔도 됩니다 경주사람들 이라는 
